{
  "qa_result": {
    "qa_id": "QA-MV-A0-EXAMPLE",
    "stage": "visual",
    "status": "pass",
    "attempt": 0,
    "summary": "Example only: A0 covers all required views with one consistent refrigerator identity and realistic smartphone-documentation appearance.",
    "next_action": "approve",
    "critical_failures": []
  },
  "reference_prompt_id": "MVP1",
  "asset_id": "A0",
  "checks": {
    "same_object_identity": "pass",
    "geometry_consistency": "pass",
    "material_consistency": "pass",
    "required_view_coverage": "pass",
    "camera_plausibility": "pass",
    "photographic_realism": "pass",
    "technical_safety": "pass"
  },
  "check_notes": {
    "same_object_identity": "All panels depict the same two-door top-freezer refrigerator without a product-variant change.",
    "geometry_consistency": "Door proportions, divider, handles, side depth, feet and rear outline remain coherent across the example views.",
    "material_consistency": "Dark-charcoal finish, trim and reflection behavior remain stable across the reference board.",
    "required_view_coverage": "All eight required views are represented once and are recognizable from the intended direction.",
    "camera_plausibility": "Perspective is compatible with a normal smartphone wide camera without fisheye or impossible orthographic mixing.",
    "photographic_realism": "Lighting, contact shadows, material reflections and processing read as plausible household product photography.",
    "technical_safety": "No unsupported hidden refrigeration internals are introduced in the reference board."
  },
  "summary": "Example A0 is suitable as a canonical reference pack because identity, geometry, materials, required views and photographic realism remain consistent.",
  "view_results": [
    {
      "view_id": "front",
      "status": "pass",
      "notes": "Example placeholder only; real A0 must be inspected."
    },
    {
      "view_id": "front_left_45",
      "status": "pass",
      "notes": "Example placeholder only; real A0 must be inspected."
    },
    {
      "view_id": "front_right_45",
      "status": "pass",
      "notes": "Example placeholder only; real A0 must be inspected."
    },
    {
      "view_id": "left",
      "status": "pass",
      "notes": "Example placeholder only; real A0 must be inspected."
    },
    {
      "view_id": "right",
      "status": "pass",
      "notes": "Example placeholder only; real A0 must be inspected."
    },
    {
      "view_id": "rear_left_45",
      "status": "pass",
      "notes": "Example placeholder only; real A0 must be inspected."
    },
    {
      "view_id": "rear_right_45",
      "status": "pass",
      "notes": "Example placeholder only; real A0 must be inspected."
    },
    {
      "view_id": "rear",
      "status": "pass",
      "notes": "Example placeholder only; real A0 must be inspected."
    }
  ],
  "critical_violations": [],
  "repair_actions": []
}
